pc_code,pc_description,unit,country_name,quantity,Per unit,categoryName,categoryID,Value,year
H9,Agro Chemicals,Kgs,Afghanistan,239068,0.716538,Fertilizers,3,171301.3066,2013
L5,"Aluminium, Products Of Aluminm",Ton,Afghanistan,1462,9.443439,Metals,2,13806.30782,2013
I8,Auto Tyres And Tubes,Nos,Afghanistan,146510,4.553477,Machinery and Parts,5,667129.9153,2019
H4,Ayush And Herbal Products,Kgs,Afghanistan,150090,1.086813,Cosmetics,6,163119.7632,2016
H5,"Bulk Drugs, Drug Intermediates",Kgs,Afghanistan,256929,2.309159,Chemicals,7,593289.9127,2016
S2,Carpet(Excl. Silk) Handmade,Sqm,Afghanistan,513,0.047252,Handicrafts,12,24.240276,2015
L6,Copper And Prdcts Made Of Copr,Ton,Afghanistan,423,5.774782,Metals,2,2442.732786,2018
P8,"Cotton Fabrics, Madeups Etc.",Na,Afghanistan,1907,2.075031,Fabric Materials,14,3957.084117,2013
